<?xml version="1.0" encoding="UTF-8"?>
<!DOCTYPE cpu SYSTEM "./IPT-COM-SRC-3.12.7.1/iptcom/sourcecode/api/iptcom-config.dtd">

<!-- Test comment for CR-8123: Ignore chars like <-> <cpu> </cpu> etc.  -->
<cpu>
	<host host-name="efd">
		<!-- Changed memory size  -->
		<device-configuration >
			<!-- Changed default PD receive thread/task parameters  -->
			<pd-receive vxworks-priority="50"></pd-receive>

			<!-- Changed default PD send thread/task parameters  -->
			<pd-process cycle-time="10" vxworks-priority="41"></pd-process>

			<!-- Changed default MD receive thread/task parameters  -->
			<md-receive vxworks-priority="51"></md-receive>

			<!-- Changed default MD send thread/task parameters  -->
			<md-process cycle-time="100" vxworks-priority="42"></md-process>
		</device-configuration>
	</host>
	<host host-name="ccu-o">
		<!-- Changed memory size  -->
		<device-configuration>
		</device-configuration>
	</host>
	<host host-name="esdno1">
		<!-- Changed memory size  -->
		<device-configuration>
		</device-configuration>
	</host>


   <!-- Communication parameters for device with URI name efd -->
   <device device-uri="efd">
      <bus-interface-list>
         <bus-interface>
				<telegram  data-set-id="2" com-id="1102" com-parameter-id="4">
					<pd-send-parameter cycle-time="200" destination-uri="efd.carA.cstA"></pd-send-parameter>
				</telegram>
				<telegram  data-set-id="2" com-id="110211" com-parameter-id="4">
					<pd-receive-parameter timeout-value="3000" validity-behavior="1" source-uri="efd.carA.cstA"></pd-receive-parameter>
					<pd-send-parameter cycle-time="200" destination-uri="efd.carA.cstA"></pd-send-parameter>
					<pd-source-filter filter-id="1" source-uri="efd.carA.cstA"></pd-source-filter>
					<pd-source-filter filter-id="2" source-uri="ccu-o.carA.cstA"></pd-source-filter>
					<pd-source-filter filter-id="3" source-uri="esdno1.carA.cstB"></pd-source-filter>
				</telegram>

				<telegram  data-set-id="2" com-id="1202" com-parameter-id="4">
					<pd-send-parameter cycle-time="200" destination-uri="ccu-o.carA.cstA"></pd-send-parameter>
				</telegram>
				<telegram  data-set-id="2" com-id="120221" com-parameter-id="1">
					<pd-receive-parameter timeout-value="3000" validity-behavior="1" source-uri="ccu-o.carA.cstA"></pd-receive-parameter>
					<pd-source-filter filter-id="1" source-uri="efd.carA.cstA"></pd-source-filter>
					<pd-source-filter filter-id="2" source-uri="ccu-o.carA.cstA"></pd-source-filter>
					<pd-source-filter filter-id="3" source-uri="esdno1.carA.cstB"></pd-source-filter>
				</telegram>

				<telegram  data-set-id="2" com-id="1302" com-parameter-id="4">
					<pd-send-parameter cycle-time="200" destination-uri="esdno1.carA.cstB"></pd-send-parameter>
				</telegram>
				<telegram  data-set-id="2" com-id="130231" com-parameter-id="1">
					<pd-receive-parameter timeout-value="3000" validity-behavior="1" source-uri="esdno1.carA.cstB"></pd-receive-parameter>
					<pd-source-filter filter-id="1" source-uri="efd.carA.cstA"></pd-source-filter>
					<pd-source-filter filter-id="2" source-uri="ccu-o.carA.cstA"></pd-source-filter>
					<pd-source-filter filter-id="3" source-uri="esdno1.carA.cstB"></pd-source-filter>
				</telegram>

				<telegram  data-set-id="2" com-id="2102">
				</telegram>
				<telegram  data-set-id="2" com-id="210212" com-parameter-id="4">
					<pd-send-parameter cycle-time="200" destination-uri="ccu-o.carA.cstA"></pd-send-parameter>
				</telegram>

				<telegram  data-set-id="2" com-id="3102">
				</telegram>
				<telegram  data-set-id="2" com-id="310213" com-parameter-id="4">
					<pd-send-parameter cycle-time="200" destination-uri="esdno1.carA.cstB"></pd-send-parameter>
				</telegram>



				<telegram  data-set-id="9" com-id="112309" com-parameter-id="1">
					<pd-send-parameter cycle-time="100" ></pd-send-parameter>
					<destination-id destination-id="1" destination-uri="efd.carA.cstA" />
					<destination-id destination-id="2" destination-uri="ccu-o.carA.cstA" />
					<destination-id destination-id="3" destination-uri="esdno1.carA.cstB" />
				</telegram>
				<telegram  data-set-id="9" com-id="11230911" com-parameter-id="1">
					<pd-send-parameter cycle-time="100" destination-uri="efd.carA.cstA"></pd-send-parameter>
				</telegram>

				<telegram  data-set-id="9" com-id="11230921" com-parameter-id="1">
				</telegram>

				<telegram  data-set-id="9" com-id="11230931" com-parameter-id="1">
				</telegram>


				<telegram  data-set-id="9" com-id="212309" com-parameter-id="1">
				</telegram>
				<telegram  data-set-id="9" com-id="21230912" com-parameter-id="1">
					<pd-send-parameter cycle-time="100" destination-uri="ccu-o.carA.cstA"></pd-send-parameter>
				</telegram>


				<telegram  data-set-id="9" com-id="312309" com-parameter-id="1">
				</telegram>
				<telegram  data-set-id="9" com-id="31230913" com-parameter-id="1">
					<pd-send-parameter cycle-time="100" destination-uri="esdno1.carA.cstB"></pd-send-parameter>
				</telegram>


         </bus-interface>
      </bus-interface-list>
      <data-set-list>
			<data-set data-set-id="2">
				<process-variable type="UINT16" name="DS2_a" array-size="1"></process-variable>
				<process-variable type="INT16" name="DS2_b" array-size="1"></process-variable>
				<process-variable type="INT8" name="DS2_c" array-size="1"></process-variable>
			</data-set>

      </data-set-list>

      <com-parameter-list>
         <!-- Communication parameters -->
			<network-parameter-ip com-parameter-id="4" qos="2" time-to-live="10"></network-parameter-ip>
      </com-parameter-list>
   </device>

   <!-- Communication parameters for device with URI name ccu-o -->
   <device device-uri="ccu-o">
      <bus-interface-list>
         <bus-interface>
				<telegram  data-set-id="2" com-id="1202">
				</telegram>
				<telegram  data-set-id="2" com-id="120221" com-parameter-id="4">
					<pd-send-parameter cycle-time="200" destination-uri="efd.carA.cstA"></pd-send-parameter>
				</telegram>

				<telegram  data-set-id="2" com-id="2102" com-parameter-id="4">
					<pd-send-parameter cycle-time="200" destination-uri="efd.carA.cstA"></pd-send-parameter>
				</telegram>
				<telegram  data-set-id="2" com-id="210212">
					<pd-receive-parameter timeout-value="3000" validity-behavior="1" source-uri="efd.carA.cstA"></pd-receive-parameter>
					<pd-source-filter filter-id="1" source-uri="efd.carA.cstA"></pd-source-filter>
					<pd-source-filter filter-id="2" source-uri="ccu-o.carA.cstA"></pd-source-filter>
					<pd-source-filter filter-id="3" source-uri="esdno1.carA.cstB"></pd-source-filter>
				</telegram>

				<telegram  data-set-id="2" com-id="2202" com-parameter-id="4">
					<pd-send-parameter cycle-time="200" destination-uri="ccu-o.carA.cstA"></pd-send-parameter>
				</telegram>
				<telegram  data-set-id="2" com-id="220222" com-parameter-id="4">
					<pd-send-parameter cycle-time="200" destination-uri="ccu-o.carA.cstA"></pd-send-parameter>
					<pd-receive-parameter timeout-value="3000" validity-behavior="1" source-uri="ccu-o.carA.cstA"></pd-receive-parameter>
					<pd-source-filter filter-id="1" source-uri="efd.carA.cstA"></pd-source-filter>
					<pd-source-filter filter-id="2" source-uri="ccu-o.carA.cstA"></pd-source-filter>
					<pd-source-filter filter-id="3" source-uri="esdno1.carA.cstB"></pd-source-filter>
				</telegram>

				<telegram  data-set-id="2" com-id="2302" com-parameter-id="4">
					<pd-send-parameter cycle-time="200" destination-uri="esdno1.carA.cstB"></pd-send-parameter>
				</telegram>
				<telegram  data-set-id="2" com-id="230232">
					<pd-receive-parameter timeout-value="3000" validity-behavior="1" source-uri="esdno1.carA.cstB"></pd-receive-parameter>
					<pd-source-filter filter-id="1" source-uri="efd.carA.cstA"></pd-source-filter>
					<pd-source-filter filter-id="2" source-uri="ccu-o.carA.cstA"></pd-source-filter>
					<pd-source-filter filter-id="3" source-uri="esdno1.carA.cstB"></pd-source-filter>
				</telegram>

				<telegram  data-set-id="2" com-id="3202">
				</telegram>
				<telegram  data-set-id="2" com-id="320223" com-parameter-id="4">
					<pd-send-parameter cycle-time="200" destination-uri="esdno1.carA.cstB"></pd-send-parameter>
				</telegram>

				<telegram  data-set-id="9" com-id="112309" com-parameter-id="1">
				</telegram>

				<telegram  data-set-id="9" com-id="11230921" com-parameter-id="1">
					<pd-send-parameter cycle-time="100" destination-uri="efd.carA.cstA"></pd-send-parameter>
				</telegram>

				<telegram  data-set-id="9" com-id="212309" com-parameter-id="1">
					<pd-send-parameter cycle-time="100" ></pd-send-parameter>
					<destination-id destination-id="1" destination-uri="efd.carA.cstA" />
					<destination-id destination-id="2" destination-uri="ccu-o.carA.cstA" />
					<destination-id destination-id="3" destination-uri="esdno1.carA.cstB" />
				</telegram>
				<telegram  data-set-id="9" com-id="21230912" com-parameter-id="1">
				</telegram>

				<telegram  data-set-id="9" com-id="21230922" com-parameter-id="1">
					<pd-send-parameter cycle-time="100" destination-uri="ccu-o.carA.cstA"></pd-send-parameter>
				</telegram>

				<telegram  data-set-id="9" com-id="21230932" com-parameter-id="1">
				</telegram>


				<telegram  data-set-id="9" com-id="312309" com-parameter-id="1">
				</telegram>

				<telegram  data-set-id="9" com-id="31230923" com-parameter-id="1">
					<pd-send-parameter cycle-time="100" destination-uri="esdno1.carA.cstB"></pd-send-parameter>
				</telegram>


         </bus-interface>
      </bus-interface-list>
      <data-set-list>
			<data-set data-set-id="2">
				<process-variable type="UINT16" name="DS2_a" array-size="1"></process-variable>
				<process-variable type="INT16" name="DS2_b" array-size="1"></process-variable>
				<process-variable type="INT8" name="DS2_c" array-size="1"></process-variable>
			</data-set>
      </data-set-list>

      <com-parameter-list>
         <!-- Communication parameters -->